{
  "schemaVersion": 1,
  "leaseId": "00000000-0000-4000-8000-000000000001",
  "ownerId": "00000000-0000-4000-8000-000000000002",
  "executorId": "calendar-fixture",
  "scope": {
    "actionTypes": [
      "calendar.block.create"
    ],
    "targetRefs": [
      "fixture-calendar"
    ],
    "accountRefs": [
      "fixture-account"
    ],
    "maximumUses": 3,
    "maximumRisk": "CONTROLLED_WRITE"
  },
  "startsAt": "2026-09-25T10:00:00Z",
  "expiresAt": "2026-09-25T10:05:00Z",
  "durationSeconds": 300,
  "sourceApprovalId": "00000000-0000-4000-8000-000000000003",
  "policyVersion": "fixture-policy-1",
  "killEpoch": 0,
  "status": "pending",
  "usedCount": 0,
  "context": "ordinary",
  "sleepEpisodeRef": null
}
